{
  "artifact_version": "anchor.gemma3-chat-five-expert-qonly-unbalanced-v2-sharded.v3",
  "claims": {
    "candidate": true,
    "diagnostic_only": true,
    "final": false,
    "formal_training_authorized": false,
    "generalization_validated": false,
    "live_authorized": false,
    "proxy_only": true,
    "quality_validated": false,
    "release_authorized": false,
    "replaces_10k": false,
    "replaces_luna": false,
    "replaces_v1": false,
    "training_authorized": false
  },
  "implementer_authority": {
    "candidate_ready_allowed": true,
    "commit_allowed": false,
    "push_allowed": false,
    "release_allowed": false,
    "release_signoff_allowed": false,
    "tag_allowed": false
  },
  "input_snapshot_inventory": [
    {
      "bytes": 2203,
      "label": "canonical_review:planner_eval:payload",
      "path": "fixtures/research/gemma3_chat_five_expert_qonly_unbalanced_v2/release_inputs/planner_eval_independent_review.json",
      "sha256": "c77fcd309af64eee689148c396d612b1b3ad20414f71482d7c9c27751d33c57c",
      "source_class": "canonical_review"
    },
    {
      "bytes": 103,
      "label": "canonical_review:planner_eval:sidecar",
      "path": "fixtures/research/gemma3_chat_five_expert_qonly_unbalanced_v2/release_inputs/planner_eval_independent_review.json.sha256",
      "sha256": "b8d3cc8b75b575a25534c41c173274215432ff5cf6bf949f6119b4bbbab3555b",
      "source_class": "canonical_review"
    },
    {
      "bytes": 2477,
      "label": "canonical_review:tool_eval:payload",
      "path": "fixtures/research/gemma3_chat_five_expert_qonly_unbalanced_v2/release_inputs/tool_eval_independent_review.json",
      "sha256": "a09ac7dc7643168342360d2bc0cd463238fd43405d5365c6efc06373f76a6082",
      "source_class": "canonical_review"
    },
    {
      "bytes": 100,
      "label": "canonical_review:tool_eval:sidecar",
      "path": "fixtures/research/gemma3_chat_five_expert_qonly_unbalanced_v2/release_inputs/tool_eval_independent_review.json.sha256",
      "sha256": "4f7e9c280aac50a4bf685176f64803fc69f5cf7c5b4967aeff0db91f8e88ed77",
      "source_class": "canonical_review"
    },
    {
      "bytes": 3798,
      "label": "component:planner_eval:payload:build_receipt.json",
      "path": "fixtures/research/gemma3_chat_unbalanced_v2_planner_comparison_eval_v1/candidate/build_receipt.json",
      "sha256": "56df42d17c0fec48ef6e52aeeffdd6cb0fa324622ed8156447b77df5b1fd10d8",
      "source_class": "component_payload"
    },
    {
      "bytes": 25370,
      "label": "component:planner_eval:payload:manifest.json",
      "path": "fixtures/research/gemma3_chat_unbalanced_v2_planner_comparison_eval_v1/candidate/manifest.json",
      "sha256": "f6cc5f4b5f63bc174bd65c71e6c0d6b224dcf9e8a90ece687fc38b5d1b7f0c05",
      "source_class": "component_payload"
    },
    {
      "bytes": 17281,
      "label": "component:planner_eval:payload:negative_inventory.jsonl",
      "path": "fixtures/research/gemma3_chat_unbalanced_v2_planner_comparison_eval_v1/candidate/negative_inventory.jsonl",
      "sha256": "61ec3954a2758dc5aa3c383fbd712adce85008ba359613fbf93bfc76a2cb4043",
      "source_class": "component_payload"
    },
    {
      "bytes": 2480914,
      "label": "component:planner_eval:payload:records.jsonl",
      "path": "fixtures/research/gemma3_chat_unbalanced_v2_planner_comparison_eval_v1/candidate/records.jsonl",
      "sha256": "591843636062b2e6915b2c4e2aafbb9dcb76b699c6dcbc95bb00f188a1ab3734",
      "source_class": "component_payload"
    },
    {
      "bytes": 288220,
      "label": "component:planner_eval:payload:token_inventory.jsonl",
      "path": "fixtures/research/gemma3_chat_unbalanced_v2_planner_comparison_eval_v1/candidate/token_inventory.jsonl",
      "sha256": "3d53386ae920c8474e189c5da92adf46e214b36ad8a960cb3cc5b1eb0449432d",
      "source_class": "component_payload"
    },
    {
      "bytes": 85,
      "label": "component:planner_eval:sidecar:build_receipt.json",
      "path": "fixtures/research/gemma3_chat_unbalanced_v2_planner_comparison_eval_v1/candidate/build_receipt.json.sha256",
      "sha256": "78a278a8aa89bf5966a24fe91139ec6d136fb3381824d26db16c3819613ce779",
      "source_class": "component_sidecar"
    },
    {
      "bytes": 80,
      "label": "component:planner_eval:sidecar:manifest.json",
      "path": "fixtures/research/gemma3_chat_unbalanced_v2_planner_comparison_eval_v1/candidate/manifest.json.sha256",
      "sha256": "2e21bdd4a35ec408cf67ad3beb32b78511345c49c583d4018aadc6bbeb91e2af",
      "source_class": "component_sidecar"
    },
    {
      "bytes": 91,
      "label": "component:planner_eval:sidecar:negative_inventory.jsonl",
      "path": "fixtures/research/gemma3_chat_unbalanced_v2_planner_comparison_eval_v1/candidate/negative_inventory.jsonl.sha256",
      "sha256": "a987669cdd3c1eca85deab39c880625097735895d302a6a1dd603634cab3fab1",
      "source_class": "component_sidecar"
    },
    {
      "bytes": 80,
      "label": "component:planner_eval:sidecar:records.jsonl",
      "path": "fixtures/research/gemma3_chat_unbalanced_v2_planner_comparison_eval_v1/candidate/records.jsonl.sha256",
      "sha256": "25e7c532fdbd3c31640061dd8e30b269bdb340e9dbfe549a062654264703b0b6",
      "source_class": "component_sidecar"
    },
    {
      "bytes": 88,
      "label": "component:planner_eval:sidecar:token_inventory.jsonl",
      "path": "fixtures/research/gemma3_chat_unbalanced_v2_planner_comparison_eval_v1/candidate/token_inventory.jsonl.sha256",
      "sha256": "945a4560af23379af0fd9e1a2c2028422d7f36bb218b4e297eb699277b5d4bbf",
      "source_class": "component_sidecar"
    },
    {
      "bytes": 1498,
      "label": "component:router:payload:build_receipt.json",
      "path": "fixtures/research/gemma3_chat_emotion_router_qonly_v1/candidate/build_receipt.json",
      "sha256": "8b409c139dad499d5c06663bb7b9712a379a32f319a009ef7f6f3c800618966d",
      "source_class": "component_payload"
    },
    {
      "bytes": 30839,
      "label": "component:router:payload:manifest.json",
      "path": "fixtures/research/gemma3_chat_emotion_router_qonly_v1/candidate/manifest.json",
      "sha256": "416e39b0617263edc3af7046ab075745dbe564430927565a1623540d63027b6d",
      "source_class": "component_payload"
    },
    {
      "bytes": 938700,
      "label": "component:router:payload:records.jsonl",
      "path": "fixtures/research/gemma3_chat_emotion_router_qonly_v1/candidate/records.jsonl",
      "sha256": "f41b865b4c65cf849c92499a0ea19ea53f2ce37f7424fa8e154543bff81f61b8",
      "source_class": "component_payload"
    },
    {
      "bytes": 91514,
      "label": "component:router:payload:token_inventory.jsonl",
      "path": "fixtures/research/gemma3_chat_emotion_router_qonly_v1/candidate/token_inventory.jsonl",
      "sha256": "67fe668b21ea935e5143362d87ab213de5b8a4c971de3c4cb836b353fcf778a3",
      "source_class": "component_payload"
    },
    {
      "bytes": 85,
      "label": "component:router:sidecar:build_receipt.json",
      "path": "fixtures/research/gemma3_chat_emotion_router_qonly_v1/candidate/build_receipt.json.sha256",
      "sha256": "fa59b127eab07f0165509271def17793a32601bcc3d052666dcc61c26da33605",
      "source_class": "component_sidecar"
    },
    {
      "bytes": 80,
      "label": "component:router:sidecar:manifest.json",
      "path": "fixtures/research/gemma3_chat_emotion_router_qonly_v1/candidate/manifest.json.sha256",
      "sha256": "a1fba4dc0176636cd176e2cafe623bdc6421ce596433f8ae20d2a02e1f734f60",
      "source_class": "component_sidecar"
    },
    {
      "bytes": 3676,
      "label": "component:tool_eval:payload:build_receipt.json",
      "path": "fixtures/research/gemma3_chat_unbalanced_v2_tool_comparison_eval_v1/candidate/build_receipt.json",
      "sha256": "464d6475069b4ebf2fb34f2c27d87d90c74ad3deb6118480ca1e68835cdcbcfa",
      "source_class": "component_payload"
    },
    {
      "bytes": 27925,
      "label": "component:tool_eval:payload:manifest.json",
      "path": "fixtures/research/gemma3_chat_unbalanced_v2_tool_comparison_eval_v1/candidate/manifest.json",
      "sha256": "ece2b2e998c44037eb7af10c6c68193aba9037035169358855b5cfa1071935f1",
      "source_class": "component_payload"
    },
    {
      "bytes": 18680,
      "label": "component:tool_eval:payload:negative_inventory.jsonl",
      "path": "fixtures/research/gemma3_chat_unbalanced_v2_tool_comparison_eval_v1/candidate/negative_inventory.jsonl",
      "sha256": "899b83076340ea8d496f5a2c8a3b355337de9add744c5a7ccb9406ac1622c364",
      "source_class": "component_payload"
    },
    {
      "bytes": 4258978,
      "label": "component:tool_eval:payload:records.jsonl",
      "path": "fixtures/research/gemma3_chat_unbalanced_v2_tool_comparison_eval_v1/candidate/records.jsonl",
      "sha256": "138a3b6b915250db0d793fb36745586e95f17881f52e8882e6d4f0df691057fe",
      "source_class": "component_payload"
    },
    {
      "bytes": 506080,
      "label": "component:tool_eval:payload:token_inventory.jsonl",
      "path": "fixtures/research/gemma3_chat_unbalanced_v2_tool_comparison_eval_v1/candidate/token_inventory.jsonl",
      "sha256": "ff0d918c9532b0b2a9ff392b783c63c410c94d65cdb77ae5c57af48bce5a467c",
      "source_class": "component_payload"
    },
    {
      "bytes": 85,
      "label": "component:tool_eval:sidecar:build_receipt.json",
      "path": "fixtures/research/gemma3_chat_unbalanced_v2_tool_comparison_eval_v1/candidate/build_receipt.json.sha256",
      "sha256": "c2e97ab8c29425d64b74e0980a989a488b1ecb7fa12792588310cebad4ed090c",
      "source_class": "component_sidecar"
    },
    {
      "bytes": 80,
      "label": "component:tool_eval:sidecar:manifest.json",
      "path": "fixtures/research/gemma3_chat_unbalanced_v2_tool_comparison_eval_v1/candidate/manifest.json.sha256",
      "sha256": "46658330eecdbdb3225eb860aa7d3ddc195ebbcf0401be2a628d702c0bebd79c",
      "source_class": "component_sidecar"
    },
    {
      "bytes": 91,